{
  "$schema": "./mlx-schema.json",
  "upstream_repo": "AtomicBot-ai/mlx-vlm",
  "tag_name": "mlxvlm-macos-arm64-07ba5a1",
  "published_at": "2026-08-28T10:38:38Z",
  "assets": [
    {
      "backend": "macos-arm64",
      "name": "mlxvlm-mlx-server-macos-arm64.tar.gz",
      "sha256": "cce16896300c340da22e34ce007b2da081d2f9b8d156d8dd61bf7fc3700f9d88",
      "size": 210514030
    }
  ]
}
